id,sen,lab
500,"XFC could elevate clinical efficacy of AS patients and enhance their autophagy, which might be achieved by acting on PI3K/Akt/mTOR signal, affecting autophagy gene and autophagy protein expression, taking part in the regulation of proliferation and differentiation of lymphocyte B, and strengthen humoral immunity.",2
501,"This therapy provides a valuable tool to accomplish a rapid decrease in vertigo spells in subjects with Meniere's disease, and it is considered an alternative to chemical or surgical labyrinthectomy.",2
502,"These elevations came with no adverse effect relative to resting heart rate, but a slight increase in blood pressure values.",1
504,"Instead, we found weak positive associations between vitamin D levels and fasting- and 2hour plasma glucose levels, HbA1c and impaired fasting glycaemia, and a negative association with beta-cell function, underlining the need for determination of the causal relationship.",1
507,"Future research should examine the separate impact of goals and planning, as well as examining mediators of behavior maintenance in physical activity interventions targeting cancer survivors.",1
508,"Because this is an observational study, comparison of techniques such as addition of fentanyl, EVE, needs a compatative study.",1
510,High-flow conditioned oxygen therapy may offer advantages for these patients.,2
511,"The study adds further evidence for the dominant cardiac sympathetic modulations on patients with preeclampsia, probably secondary to parasympathetic withdrawal in this group.",1
512,Standard practice in pupillary monitoring yields inaccurate data.,0
513,The 2 interventions were acceptable to participants and equal with regard to perceived credibility and acceptability.,1
516,We concluded that high-dose (4 g) MO leaf powder capsules significantly increased insulin secretion in healthy subjects.,2
517,Fewer patients responded to GDHT than anticipated.,1
518,The acupuncture at the acupoints selected from the affected meridians based on the location differentiation and the heavy moxibustion at painful points are safe and effective in the treatment of fibromyalgia syndrome and present the better persistent effect as compared with the combined medication of tramadol sustained release tablets and amitriptyline.,2
519,"Taken on a daily basis, thermogenic dietary supplementation may increase overall energy expenditure, potentially leading to reductions in fat mass over time.",2
521,"At the same anaesthetic depth, the CIIA method outperforms the TIVA method in suppressing the stress response and obtaining smooth awakening after laparoscopic radical gastrectomy for patients with gastric cancer; therefore, the CIIA method has a better anaesthetic effect.",2
522,"The moxa salt packets combined with tropisetron hydrochloride can effectively reduce the cisplatin chemotherapy-induced nausea and vomiting as well as the occurrence rate of delayed-type vomiting, and improve the constipation, which is superior to single use of tropisetron hydrochloride.",2
523,And it has similar immunotherapy efficacy between monosensitized and polysensitized children.,1
525,Application of PRP showed a positive effect on AGA and could be regarded as an adjuvant therapy for AGA.,2
527,"The key lessons learned from this study is that continuous rucaparib dosing is required for optimal response, the recommended phase 2 dose (RP2D) for continuous oral scheduling has not been established and requires further exploration and, thirdly, the use of a PD biomarker to evaluate dose-response has its limitations.",1
528,"β-Lactam-allergic patients who need ertapenem therapy should undergo skin tests and, if negative, a graded challenge to assess tolerability.",1
529,"CAM use was significantly associated with gender, age, career and duration of diabetes.",1
530,Incorporating paravertebral blocks carries considerable potential for improving pathways for breast cancer patients undergoing breast reconstruction--with minimal procedure-related morbidity.,2
533,"The results obtained indicate that the adjuvant treatment of psychosocial day care programme has a positive effect on treatment outcomes: on the increase of the patients' quality of life, and, to some extent, on the decrease of symptom intensity in positive symptoms in schizophrenia spectrum.",2
534,"The lenalidomide combined with chemotherapy can significantly decrease the expression level of VEGF and bFGF, and enhance the remission rate of patients with AML.",2
536,"Together, these findings suggest that personalised decision support systems could be an important development in shared decision-making and patient-centered care.",1
537,The pemetrexed-carboplatin combination was effective and well-tolerated in patients with EGFR-wild-type non-squamous NSCLC (UMIN-CTR number: UMIN000003393).,2
539,"Dynamic multiple pelvic angiography has significant advantage in the diagnosis of pelvic peritoneal hernia, and can provide a more objective basis for the diagnosis of functional defecation disorder.",1
541,Tramadol appears to be consistently well tolerated following i.v.,2
542,Combined aerobic and stretching exercises brought about significant therapeutic effects on selected cardiopulmonary parameters in female BC survivors.,2
545,Further study is needed to confirm our pilot findings.,1
549,"Among postmenopausal women with osteoporosis, the use of subcutaneous abaloparatide, compared with placebo, reduced the risk of new vertebral and nonvertebral fractures over 18 months.",2
550,Overnight closed-loop therapy resulted in better glucose control than sensor-augmented pump therapy in pregnant women with type 1 diabetes.,2
551,B- TURBT is a reasonable treatment modality in patients with NMIBC.,1
553,"When renal function is impaired and if basal kalemia is >4.35 mmol/L, then clinicians should properly balance risk and benefit of eplerenone use and offer dietary advice.",1
555,SMT C1100 was well tolerated in pediatric DMD patients.,2
556,Further research is necessary to evaluate these preliminary findings in a larger study population with longer follow-up to determine whether the observed effects will result in improved clinical outcomes.,1
557,"Among patients with advanced melanoma, pembrolizumab administration was associated with an overall objective response rate of 33%, 12-month progression-free survival rate of 35%, and median overall survival of 23 months; grade 3 or 4 treatment-related AEs occurred in 14%.",1
558,"Penetration acupuncture at the acupoints of GV and bladder meridian on head can remarkablely improve the cognitive function of the patients with mild cognitive disorder after stroke,and have some efficacy of relieving the bad mood such as depression.",2
560,"Hark improved the quality of transfer of information about simulated patients and was rated by users as more effective and efficient, and less distracting than pagers.",2
561,"Although EC is widely used as a method of quitting smoking, it has negative effects on the sinonasal symptoms and MCC.",0
563,The results indicate that RKB evening meal has an anti-diabetic potential and that the increased release of satiety hormones and improvements of appetite sensation could be beneficial in preventing obesity.,2
565,Ultrasound guided lower limb peripheral nerve blocks are an efficient technique of regional anesthesia in children.,2
566,The results show that platelet rich plasma provided better results from the perspective of pain control and effect duration.,2
567,This study shows for the first time the beneficial effect of memantine to prevent post-mastectomy pain development and to diminish chemotherapy-induced pain symptoms.,2
568,"In patients with HHT, a bevacizumab nasal spray treatment of 3 administrations at 14-day intervals with doses of 25 mg, 50 mg, or 75 mg per spray, compared with a placebo, did not reduce monthly epistaxis duration in the 3 consecutive months immediately after the end of treatment.",0
570,"The sedative effects of dexmedetomidine in the ICU patients treated with ventilator bundle treatment are satisfactory, and it can shorten the duration of mechanical ventilation, extubation time and length of ICU stay, reduce the incidence of delirium.",2
573,Exercise and DHA supplementation acted synergistically by increasing plasma PGE2 with anti-inflammatory effects.,2
574,"Furthermore, it was concluded that hyoscine-N-butylbromide can increase the risk of drug-related complications.",0
575,This study is useful in that it compares two common methods of preparation of the upper limb prior to tourniquet inflation and which have not previously been compared in this context.,1
577,"The low lactose milk powder could improve the therapeutic effectively and could reduce the duration of disease, and restored to normal diet for 2 weeks feeding time.",2
580,"Already after three months the effect of training with tailor-made notched music is observable in the most direct rating of tinnitus perception - the tinnitus loudness, while more global measures of tinnitus distress do not show relevant changes.",1
581,"The efficacy mechanism is probably relevant to the positive regulation of blood glucose, lipid metabolism, fat-islet endocrinal axis and automatic nerve function.",1
582,Early screening of these disorders and prompt tailored pharmacological and behavioral interventions can potentially reduce cocaine use and improve response to MMT.,2
583,"CTP could not only reflect the change of tumor size, but also reflect vascular function of the tumor.",1
584,For the assessment of the specific effectiveness of the Baghira group training further and larger studies are required.,1
585,A combination of PS and continuous inhalation of budesonide aerosol has a better efficacy in the treatment of NRDS than a combination of PS and budesonide solution.,2
588,SIT decreases the expression of GM-CSF and IL-5 and reduces the inflammatory reaction in the tissue samples of recurrent nasal polyps.,2
589,"ZHENG's gold hook fishing acupuncture could effectively improve the symptoms and sings of LDH, reduce the disability index and improve the quality of life, which is superior to EA.",2
590,ALIF shows a tendency to faster pain relief and return to activity with less intraoperative blood requirement in low grade isthmic spondylolisthesis.,2
591,There is a trend toward improved local tumor control and progression-free survival with proton beam.,2
592,Our results support the use of distortion correction to ensure accurate and careful application of DWI to neurosurgical practice.,1
596,HFpEF patients with RVD and impaired RV-PA coupling have more advanced heart failure.,0
597,"Furthermore, IL-35 should be incorporated into nomogram to generate a more accurate predictive model.",1
598,"Sodium bicarbonate combined with ulinastatin can improve the therapeutic effect and reduce complications in the treatment of acute phoxim pesticide poisoning, and have beneficial effects on the recovery of cholinesterase activity.",2
599,The present findings indicate that topiramate is effective and safe and thus reinforce previous data suggesting that topiramate is a potentially useful treatment for crack cocaine dependence.,2
601,Serum S100P protein and NSE could be changed by pre-operation injecting Ligustrazine at certain dose in elderly patients undergoing orthopedics operations.,1
603,The diagnosis of TRS by FISH was highly sensitive and enabled genetic confirmation of the pathological diagnoses.,1
605,We investigated a heterogeneous group of medicated male and female patients.,1
607,Counties offering HPV vaccination to catch-up groups in schools reached the highest vaccine uptake.,1
608,"Among critically ill patients treated in ICUs in Brazil, implementation of a multifaceted quality improvement intervention with daily checklists, goal setting, and clinician prompting did not reduce in-hospital mortality.",0
610,Our findings indicate the general effectiveness and practicality of Web-based computer-tailored interventions in terms of increasing self-reported habit strength for physical activity and fruit and vegetable consumption.,1
611,Synergy observed in preclinical phase did not turn into ability to improve clinical outcomes.,0
612,"TCM clinical outcomes rating scale for HF based on patients' report had good reliability, validity and responsiveness, hence it could be used to assess clinical efficacy for HF patients.",2
614,Further follow-up is needed to assess long-term effects on health outcomes.,1
616,Computer-tailored feedback could be a cost-effective way to target alcohol use and binge drinking among adolescents.,2
617,The dynamics of this improvement differed both between cognitive domains and the time-points assessed.,1
618,"Opinions, interpretations, conclusions and recommendations are those of the author and are not necessarily endorsed by the Department of Defense.",1
619,There were no differences in post-operative lactate levels or clinical outcomes between patients receiving thiamine or placebo.,1
620,Our findings suggest in vivo training should be included to facilitate proficiency with device-specific intubation techniques.,1
621,Further research is needed to determine if modified approaches to primary care management may be more effective.,1
622,"Passive self-ligating brackets and conventional brackets can cause root resorption, but the difference was not significant.",1
624,Future RCTs are planned to evaluate the clinical efficacy of the 2 interventions.,1
625,Pre-interventional consideration of weight loss within 30 days and having weight loss as a prioritised goal during the health consultation were two important predictors for weight loss.,1
626,"However, further studies involving biochemical and neurodevelopmental evaluation, with long-term follow-up in larger populations are needed to clearly compare both formulas.",1
628,"It is safe, convenient and practicable to perform budesonide treatment in middle meatus following ESS, which can significantly ease the post-operative discomfort of nose.",2
629,A program to motivate students to act as change agents of family's lifestyle was effective in decreasing weight and increasing physical activity of their mothers.,2
630,Rucaparib is well tolerated and results in high levels of PARP inhibition in surrogate tissues even at the lowest dose levels.,2
631,This clinical trial indicates that treatment with a novel custom-made OAm can reduce the severity of sleep-disordered breathing by significantly decreasing the AHI and VAS scores.,2
632,"By using health literacy-focused strategies, the intervention was robust in achieving reductions for participants of varying health literacy status.",1
633,"In a nationally representative sample of couples, the OurRelationship program was effective in significantly improving both relationship and individual functioning, suggesting it can substantially increase the reach of current interventions through its low-cost, Web-based format.",2
634,"TEAS can efficiently prevent orthodontic toothache and oral dysfunction, which is superior to psychological intervention and similar to medication.",2
635,An immune response was observed after primary immunization with Ad26.ZEBOV; boosting by MVA-BN-Filo resulted in sustained elevation of specific immunity.,2
637,Better treatment agents for leprosy patients with reactions and nerve damage are needed.,1
638,"The real-world data showed that daptomycin was effective and safe in the treatment of various Gram-positive infections, including those caused by resistant pathogens, across wide geographical regions.",2
639,"ZZYCR could improve the clinical efficacy of NASH patients, and its mechanism might be associated with inhibiting serum levels of FFA and TNF-alpha.",2
640,"Among patients with 1 to 3 brain metastases, the use of SRS alone, compared with SRS combined with WBRT, resulted in less cognitive deterioration at 3 months.",2
641,The present study showed that combination of degarelix and antiandrogen could lead to favorable PSA reduction and immediate castrate level at an earlier phase.,2
642,In this pilot study the combined interventions have shown to be effective in clinical primary care for the treatment of ODD and beneficial for the children and their families.,2
644,There is better patient-proxy agreement for the EQ-5D-3L compared with the ICECAP-O among individuals with mild VCI.,2
647,LIBERTY will investigate real-world PAD patients treated with endovascular revascularization with rigorous study guidelines and independent oversight of outcomes.,1
648,"At the recovery room, no significant efficacy difference between low-dose ketamine (0.25 mg/kg) and placebo in the prevention of post operative shivering in patients who underwent orthopedic surgery was observed.",0
649,"In construction workers, integral nutrition intervention at the individual, group and environmental level had an impact in nutritional and biochemical indicators.",1
650,"Women in STARTS and SUPPORT reported postpartum improvements in mood and stress, and the experience of fewer depressive symptoms and less perceived stress was related to sustained abstinence.",1
651,"In this open-label, randomized trial involving patients with locally advanced pancreatic cancer with disease controlled after 4 months of induction chemotherapy, there was no significant difference in overall survival with chemoradiotherapy compared with chemotherapy alone and there was no significant difference in overall survival with gemcitabine compared with gemcitabine plus erlotinib used as maintenance therapy.",0
653,"Further engagement with the provider team, the patients/care takers and the health care financing agency to integrate SMBG in the care protocol for poor control diabetes should be considered.",1
654,"The effect of oblique insertion at anatomical points for sacroiliac joint injury is superior to that of conventional acupuncture, which can effectively relieve pain and improve the disfunction.",2
656,The newly-developed memory expansion screw takes advantage of rapid and slow maxillary expansion protocols.,1
657,"However, monitoring should be strengthened in order to prevented and control the adverse effects such as severe hypotension and severe bradycardia.",0
658,"The success rate of TRV-CRP was higher than that of manipulative reduction,but manipulative reduction comfort degree was higher than TRV-CRP, the two methods can both improve the quality of life of patients with BPPV.",1
660,"However, there is still a need to investigate a larger series of cases.",1
661,"The pretreatment of 0.02 mg/kg cisatracurium given 5 minutes before succinylcholine injection could alleviate succinylcholine-induced fasciculations without influence on muscle relaxation effects or endotracheal intubating conditions, but did not affect the occurrence of myalgia, and might produce transient diplopia and difficulty opening eyes.",1
663,In a fasted and glycogen-reduced state ingestion of a CHO solution during high-intensity exercise enhanced performance through stimulation of insulin-mediated glucose uptake.,2
664,"The significant improvement of clinical conditions was shown by the end of the treatment course using both clinical assessments and HAMD-17, CGI-S, CGI-I and MMSE scores in both groups.",2
666,EA improves effectively the quality of life in MUI patients and the clinical efficacy is apparent.,2
667,"Education about opioid overdose and naloxone use in a community treatment program increases overdose knowledge, providing support for the idea of making OE a routine part of substance use disorder treatment.",1
668,Additional modelling could explore the potential economic impact of the intervention on morbidity and mortality.,1
669,The administration of a 5 mg post-operative dose of tadalafil to patients that had undergone a bilateral NSRP was found to have a positive effect on the recovery and maintenance of erectile function.,2
671,Both tipranavir/ritonavir use and high baseline ALT levels were associated with an increased risk of ALT.,0
672,Providing an educational video intervention about CATH may effectively decrease periprocedural anxiety levels.,2
674,HE's fire needle therapy is effective on primary varicose veins.,2
675,This study showed no effects.,0
676,Scalp acupuncture could attenuate central nervous system lesion and improve POCD of elderly patients undergoing hip replacement.,2
678,"These preliminary findings were based on unplanned early termination of the trial, and a larger multicenter trial is needed to evaluate the potential benefit of this approach.",1
681,"A technically more robust system, combined with additional attractive games, likely results in higher patient motivation and better compliance.",2
682,"Group F and group E demonstrated similar fast motor recovery, but the former caused less intraoperative pain than the latter.",2
683,NBI endoscopy plays an important role in the clinical diagnosis and accurate pathologic specimen acquisition of laryngeal carcinoma and can be a regular means to detect laryngeal lesions in clinical.,1
685,"However, new strategies to improve implementation of interventions should be created.",1
686,Patients treated with melatonin-containing emulsion experienced significantly reduced radiation dermatitis compared to patients receiving placebo.,2
688,Concerning the inguinal hernia repair we found better postoperative pain scores and 24 hours reduction of the morphine consumption in group III (GA and TAP-D block) compared with group I (GA) and group II (GA + TAP block).,2
689,The Tat Oyi vaccine in association with cART may provide an efficient means of controlling the HIV-infected cell reservoir.,2
691,"Compared with the traditional method, small incision puncture tracheostomy is less time consuming, with fewer traumas, and fewer intraoperative and postoperative complications.",2
692,"However, such a micro-level approach must be understood from a broader societal perspective including gender relations on both the macro- and the meso-level.",1
693,"Administration of piroxicam after IUI is associated with decreased number of cycles, as well as increased pregnancy rate and pregnancy rate per cycle in IUI cycles.",2
694,Andrew's manoeuvre (four-hands CC) during the simulated DA-CPR significantly improved the performance of elderly female rescuers and helped them to achieve the recommended CC depth.,2
695,Trial and reference preparations are bioequivalent under fasting and fed state.,1
696,The patients treated with two cycles of intra-articular injections of Hymovis® have a progressive pain reduction that is maintained up to one year after the treatment start with improve of all the scores considered in this study.,1
697,An understanding of all of these mechanisms will be key in directing the advancement of products most suitable for combating HIV infection in women.,1
698,"Further research is needed to understand the clinical importance of RD, the risks and benefits of abaloparatide treatment, and the efficacy of abaloparatide vs other osteoporosis treatments.",1
702,The hierarchical strategy based on the combination of embryo cleavage patterns and timing parameters is effective for selecting the optimal embryo.,2
703,"Obtained ahnost the same satisfactory radiological outcomes after patella resurfacing and retention groups after total knee replacement allows us to conclude that, primary TKA without patella resurfacing is a good treatment option in patients with high grade osteoarthritis of the patellofemoral joint.",2
705,"Acupuncture therapy can effectively reduce the visceral fat content, being better than simple health education.",2
706,Follow-up for cognitive and physical problems that may not become evident until later in life is required.,1
708,"Nasal endoscope negative pressure cleaning and sinupret drops can significantly reduce the long-term incidence of RNS, especially obviously reduce the incidence of moderate to severe RNS,which is a practical and effective method to treat RNS.",2
711,Our NPD is better than standard wound care procedures and cost-effective for management of PU.,2
712,Individual baseline thermography image features can be predictive of the response to lid warming therapy.,1
713,"In patients with active RA, tofacitinib, either in combination with methotrexate or as monotherapy, demonstrated rapid and sustained improvement in pain, physical functioning and health-related quality of life.",2
714,"131I-chTNT radioimmunotherapy with PMCT has a complementary effect in NSCLC, which can effectively improve therapeutic ratio and survival of patients effectively and has the same effect as that of post-operative adjuvant chemoradiation.",2
717,"Among adults with opioid dependence maintaining abstinence with a stable dose of sublingual buprenorphine, the use of buprenorphine implants compared with continued sublingual buprenorphine did not result in an inferior likelihood of remaining a responder.",0
720,"SIPsmartER also yielded small, yet significant, improvements in BMI.",2
721,"Our data suggest that among patients with pretransplantation minimal residual disease, the probability of overall survival after receipt of a transplant from a cord-blood donor was at least as favorable as that after receipt of a transplant from an HLA-matched unrelated donor and was significantly higher than the probability after receipt of a transplant from an HLA-mismatched unrelated donor.",2
722,This is the first controlled study on the long term effect on professionals from implementing a development plan to enhance user participation in a mental health hospital.,1
723,"As a result, electro-acupuncture (EA) might be useful in controlling the ongoing epidemics in obesity and T2DM.",2
724,Further studies are needed to assess long-term efficacy and safety.,1
725,Self-management education could effectively improve the symptoms of primary dysmenorrhea and quality of life.,2
