id,sen,lab
727,Position-independent rebound tonometry (Icare PRO) accurately measured IOP in supine children's eyes postoperatively in the presence of intracameral air.,1
728,A valid comparison of outcomes between the control group and the intervention group involved in the study was provided in this trial.,1
729,"The present study provides evidence of higher MPV and lower vitamin D levels in children with PS as well as in children with OSAS, and supports the underlying inflammation, hence, highlighting the importance of an early diagnosis of this previously considered benign form of SDB.",1
730,"Contrast-enhanced ultrasound measurements of tumor peak enhancement, rate of enhancement, and AUC1 were early predictors of time to progression in a cohort of children and adolescents with recurrent solid tumors treated with antiangiogenic therapy.",1
731,"Given that most pregnant quitters will relapse within 1 year postpartum and that postpartum smoking has negative health consequences for women and children, effective interventions that target postpartum mood and stress are needed.",1
734,"Acupuncture method of ""Huoxue Sanfeng, Shugan Jianpi"", characterized with standard manipulation criteria, can effectively control morning blood pressure in patients with cerebral infraction combined with essential hypertension.",2
736,"Chinese massage therapy decreased pain and may improve extensor muscle strength in patients with knee OA, but does not appear to improve ROM.",2
737,"However, over more than a decade of follow-up, nearly 14% of patients developed recurrence because of new non-PV triggers.",0
738,Further study is needed with a larger sample size.,1
739,"This study was done in part that registered with Japan Pharmaceutical Information Center, number JapicCTI-121850.",1
741,The findings from the present study emphasize the use of accelerometer analysis in clinical practice to make more accurate prognoses in addition to extract features of physical activity relevant to functional classification.,1
742,"Among critically ill patients with an ICU length of stay of 72 hours or longer, a conservative protocol for oxygen therapy vs conventional therapy resulted in lower ICU mortality.",2
744,"Pain scores, opioid use, time to mobilisation, and length of stay were low in both Group Ropivacaine and Group Placebo.",0
745,Longitudinal studies are needed to verify the long-term effects of this approach.,1
746,We demonstrated for the first time that AVP values could improve after successful treatment in STEMI patients.,2
747,"The study found a statistically significant value for function, pain and alignment in patients who underwent surgical treatment, compared with their status prior to surgery.",1
748,Biventricular patients with an ostial stenosis had a higher probability of a successful outcome.,2
750,"DDM reduces postoperative pain severity, hospital stay and disability period.",2
754,"Scalp acupuncture treatment can improve the ACI patients' clinical symptoms, probably by reducing ACl induced inflammatory reactions.",2
756,They were also associated with lower frequencies of postoperative vomiting.,2
757,The preoperative dexamethasone should be used as routine in patients undergoing laparoscopic cholecystectomy.,1
759,"SM could effectively promote and accelerate cleaning and mucosal epithelization of functional endoscopic sinus surgery, and significantly promote mucosal ciliary structure and function recovery of ostium-meatus nasicomplex.",2
760,It can be postulated that AVP has strong correlations with the inflammatory markers.,1
761,Nebulized budesonide is an effective and safe alternative to SGCS in treating an exacerbation of COPD.,2
762,These effects could possibly be mediated through colonic fermentation.,1
763,The proposed treatment is not less effective compared with the McDonald's trial.,2
765,"However, marital status, religion, education, health insurance types and conventional regimen for diabetics were not associated with CAM use.",1
767,"It seems that in order to reduce the incidence of these injuries in female recruits, emphasis should be directed at other factors such as modifications in equipment weight, as well as modifications in the intensity of the training programs.",1
769,"By contrast, HIS+LV pacing yielded improvements, regardless of AVD setting.",2
770,"For multiple ligament injuries in the knee, staged repair and reconstruction can effectively restore knee joint stability and function.",2
771,"Compared with DICE regimen combined with rituximab, GDP regimen combined with rituximab in treatment of elderly patients with relapsed and refractory diffuse large B cell lymphoma can efficiently reduce tumor loading, prolong the disease-free survival time, improve the long-term clinical prognosis, and not aggravate the side effects of drugs.",2
772,"Concurrent using QQD with chemoradiotherapy for treating esophageal carcinoma patients could lower the incidence of radiation pneumonitis, attenuate the degree of radiation induced lung injury, improve clinical benefit rate, and elevate their QOL.",2
773,Planning constraints should keep rectal V38 below 2.0 cm(3).,1
774,"Compared with PB, TPM showed a better effect on epilepsy treatment with less adverse reactions which were worthy of clinical recommendation.",2
775,Our findings also highlight the need for replication studies in brain stimulation research.,1
776,COPD underdiagnosis is a major problem in primary care.,1
777,"In addition, it can avoid possible side-effect of medication.",2
778,This is the first prospective study designed to assess paravertebral blocks in the setting of prosthetic breast reconstruction.,1
782,"Our results suggest that following a stroke, the brain may be less responsive to non-invasive brain stimulation paradigms that aim to induce short-term reorganisation, and aerobic exercise was unable to induce or improve this response.",0
784,Intraoperative dexmedetomidine does not reduce postoperative opioid consumption or improve pain scores after multilevel deformity correction spine surgery.,0
786,"Targeted therapy combined with chemotherapy for the primary central nervous system lymphoma can improve the patients' outcomes, reduce adverse effects, and improve the quality of life and survival rate.",2
787,Conjunctival TE rates can be effectively reduced by lid warming treatment in some MGD patients.,2
788,"Thus, tools for clinical assessment can be developed from empirical studies in various clinical settings.",1
789,"Single-dose preoperative dexamethasone 8 mg 60-90 minute before induction of anesthesia improved clinical outcome in terms of significantly less nausea, vomiting, pain at first 6 hours and less inflammatory response after laparoscopic cholecystectomy compared to placebo.",2
792,Using the hearing application test may decrease the demand for audiological services in underserved areas.,1
794,Full robotic gastrectomy with intracorporeal robot-sewn anastomosis for gastric cancer is safe and does not increase the complication risk during or after surgery.,2
795,"The findings provide preliminary evidence that this intervention may offer an efficient way of concurrently reducing CAS and mental health problems, such as sexual compulsivity and loneliness, for HIV+ gay and bisexual men.",2
796,"In clinical work, we should reasonable combine the two methods,so as to improve the cure rate of RPPV.",1
1193,"While both lifestyle and metformin interventions used to prevent diabetes increase HDL-C, the mechanisms involved differ between the two treatments and may have consequences for future risk of cardiovascular disease.",0
1194,"JXT could improve heart function of CHD patients to different degrees, and its curative effect was better than that of routine Western medicine (Simvastatin Tablets) treatment.",2
1195,"For type Crowe II developmental dysplasia of hip patients, 15° face-changing acetabular cups in THR could obtain higher actebular component coverage rate and satisfactory early clinical effects.",2
1196,"Among ambulatory adults aged 75 years or older, treating to an SBP target of less than 120 mm Hg compared with an SBP target of less than 140 mm Hg resulted in significantly lower rates of fatal and nonfatal major cardiovascular events and death from any cause.",2
1197,"For future studies, because dyads often commented positively about the pleasure and support they received, it might also be valuable to measure quality of life outcomes such as relationship quality, pleasure, and self-esteem in dyadic focused interventions.",1
1198,"While the current intervention improved cognitive functions, the cause-effect relationship, if any, with the concomitant neuromuscular adaptations remains to be explored.",1
1199,"Several challenges were identified the most important of which was concerns with achieving adherence to DP in non-trial settings, requiring operational feasibility studies in routine health systems.",1
1200,"Overall, the DEAL Project was associated with more rapid improvement in both depression symptoms and alcohol use outcomes in young people with these co-occurring conditions relative to an attention-control condition.",1
1201,SSI after an open appendectomy remains an important problem.,1
1202,Both MM and VDO were significantly improved by use of occlusal splints pretreatment.,2
1203,"In order to determine a true incidence of SSI, it is necessary to improve the national nosocomial infection surveillance system.",1
1204,The clinical impact of prolonged IL-10 needs further evaluation.,1
1205,Secure VCEs can be conducted using widely available hardware and software solutions.,1
1206,"For Chinese glomerulonephritis patients with stage 2 chronic kidney disease, therapy with A & As particles may provide effective anti-proteinuria treatment.",2
1208,This would reduce the need for parents to motivate their children extrinsically and allow for clinical trials to investigate the effectiveness of the system.,1
1209,This is the first study to characterize the population PKs of sirolimus using a two-compartment model in healthy Chinese subjects and renal transplant patients.,1
1210,"Motivational deficits are significantly linked to the functional impairment present in many people with major depression, just as they are in other psychiatric illnesses such as schizophrenia.",1
1211,"T II A could reduce the incidence of OlPN, which might be associated with inhibiting the expression of CGRP and up-regulating NGF activities.",2
1213,"Consequently, Metformin and acupuncture combined therapy is more effective than Metformin only, proving that acupuncture is an insulin sensitizer and is able to improve insulin sensitivity possibly by reducing body weight and inflammation, while improving lipid metabolism and adipokines.",2
1214,Interpretation of batches of mammograms by qualified screening mammography readers using a different order vs the same order for the second reading resulted in no significant difference in rates of detection of breast cancer.,1
1215,Anticholinergic medication use was associated with increased risk for recurrent falls.,2
1216,"During operation, the degree of blood oxygenation in these groups decreased by 57% and 41%, respectively.",1
1217,"Radiofrequency hyperthermia combined conformal radiotherapy is remarkably effective in treating patients with HCC, which could effectively reduce the damages of radiotherapy to the liver, enhance the patient' s tolerability and improve the patients' short and long term survival.",2
1218,The authors suggest that the administration of 14% Plai cream is a useful alternative in the management of DOMS.,2
1219,"Therefore, supplemental 80% FiO2 during and 6 hours after open surgery for acute sigmoid diverticulitis, reducing post-operative SSI, should be considered part of ongoing quality improvement activities related to surgical care, accompanied by few risk to the patients and little associates cost.",1
1220,We did not find any reduction of the pro-inflammatory response in our patients and therefore no changes in their perioperative course.,1
1224,Vitamin D deficiency was associated with higher disease activity and severity and presence of metabolic syndrome.,0
1225,"Results of this study suggest that the impact of PA on depressive symptoms varies by genotype and sex, and that PA may mitigate somatic symptoms of depression more than other symptoms.",2
1227,"Among patients recently hospitalized with heart failure and reduced LVEF, the use of liraglutide did not lead to greater posthospitalization clinical stability.",0
1228,The data show that investigators planning RCST's in surgery should be aware of the large amount of effort and significant financial resources needed to achieve patient recruitment goals.,1
1229,"However, IVR-based interventions may be the optimal choice for those with elevated LDL values at baseline.",2
1231,"In the conservative treatment, mifepristone can safely improve the hormone levels, reduce the thickness of the endometrium, alleviate symptoms.",2
1232,"However, piroxicam did not have any effect on abortion, multiple pregnancy, and ongoing pregnancy rates.",1
1233,"The efficiency of CHOP regimen containing PLD for the aged patients with advanced DLBCL has been confirmed to be significant, and its cardiac toxicity is low, thus being worth to be popularized and applied for the treatment of advanced diffuse large B-cell lymphoma.",2
1234,The PHC Cage is similar to the PEEK Cage and has good clinical outcome in short-term follow-up.,2
1235,Polymorphisms in CYP3A5 and ABCB1 may define a subset of patients with different cabazitaxel toxicity and efficacy and therefore could be used as markers for treatment optimization.,2
1238,These findings support a role of CYP2C19 genotype in the efficacy of this treatment.,2
1239,Neither sevoflurane nor propofol had any significant impact on the occurrence of postoperative complications.,2
1241,Short-term body composition benefits of an RT+CR intervention may be lost within 18 months after completion of the intervention.,1
1244,"Acupuncture stimulation of SP 6 has an immediate analgesic effect in PD women with cold damp stagnation syndrome, which was not affected by needling-induced sharp pain, deqi-expectation, and thicker or thinner needle with shallow and deeper insertion.",2
1248,"Outcomes of colorectal endoscopic submucosal dissection were acceptable in selected patients, with no difference in outcomes according to clinical indications.",2
1249,Laser assisted hatching with quarter technique improves pregnancy and implantation rates in poor prognosis patients.,2
1250,Rectal V38 and 2 clinical factors were strong predictors of HH following 5-fraction SABR.,1
1251,The analgesia method of ACM could reduce the dosage of traditional analgesic drugs and the occurrence of partial adverse reactions.,2
1252,Integration of BMI control with vision-guided robotic assistance led to improved performance on object transfer tasks.,2
1253,"With regards to the primary aim of this study, there were overall high levels of satisfaction with the intervention, indicating good feasibility and acceptance among patients.",2
1254,Larger studies are needed to assess the effect of cerebral protection device use on neurological and cognitive function after TAVI and to devise methods that will provide more complete coverage of the brain to prevent new lesions.,1
1255,Availability of spirometry should be a priority in this setting.,1
1256,"This outcome may result from a link between innate immunity and IgE-mediated, adaptive immune responses in asthma, and point to TLR4 as a potential therapeutic target.",1
1257,It could be worthwhile to aim the intervention specifically at specific subgroups.,1
1258,"Despite its shorter half-life, letrozole seems to be as least as likely, if not more, to adversely affect cervical mucus.",0
1259,"The hydroxyurea shows a better curative effect on TI patients, no serious side reactions occur in all the patients treated with hydroxyurea, but the long-term curative effect and side reactions should be observed continuously.",1
1260,"All three bitopertin treated groups showed improvements in all the efficacy endpoints for both of the two symptoms, i.e., ""negative symptoms"" and ""sub-optimally controlled symptoms"", throughout the duration of the study.",2
1261,"Among at-risk patients presenting to the ED, the use of aspirin compared with placebo did not reduce the risk of ARDS at 7 days.",0
1262,Further large studies are needed to confirm effectiveness of the proposed CMP.,1
1263,The combination of INS and Oxymet provides additional benefit compared to INS monotherapy in relieving nasal congestion in subjects with chronic rhinitis and allergic rhinitis without developing rhinitis medicamentosa.,2
1264,"A complex therapy cannot be limited to a single drug only, and to make better decisions, one should consider not only ocular, but also general condition of the patient.",1
1265,Both EA and meloxicam are effective in the treatment of KOA at the early and middle stage.,2
1266,"This methodology may be useful for diagnosing, directing treatment, and judging prognosis of alcoholic cardiac damage.",2
1267,More long-term studies are thus warranted.,1
1268,Knowledge of these relationships may help identify LTRs at the greatest risk for poor sleep and guide strategies to promote sleep and optimize HRQOL.,1
1269,"Regarding the improvement in foul breathing, the effect in the palmar thumb surface group is better than that in the radial margin group.",2
1270,Early weight loss is consistently identified as a strong predictor of long-term weight loss.,1
1271,The relationship for ALT appears specific for death due to cardiovascular disease.,0
1272,Biliary CEACAM6 can identify patients with extrahepatic cholangiocarcinoma with a high degree of sensitivity and should be investigated further as a potential screening tool.,2
1273,However Botulinum toxin type A (Botox®) showed statistically significant more increased in pressure pain threshold at 6-week after injection without severe adverse effects.,2
1274,Using 14% Plai cream over a 7-day period substantially reduced muscle soreness symptoms compared to 7% Plai cream or a placebo cream.,2
1276,"Its clinical effect is better than NPWT or porcine ADM dressing alone, and this method may be suitable for patients with non-surgical treatment.",2
1278,The results presented support further development of the C. difficile vaccine candidate in a larger population of subjects to determine the optimal dose and immunization schedule.,2
1280,These data support safety and efficacy of TAVR in select very elderly patients.,2
1281,A systematic intervention model resulted in partial improvements in LBP care.,2
1283,"Ultrasound-guided interscalene brachial plexus block with an extrafascial injection reduces the incidence of hemidiaphragmatic paresis and impact on respiratory function while providing similar analgesia, when compared with a conventional injection.",2
1284,The safety profile of CT-P13 was also similar to that of RP.,1
1285,The CMP used in the study have showed a trend to significant SSI risk reduction and may be recommended to maximize patient protection.,2
1288,"Investigations on the effects of low-volume HIIE protocols including a fewer number of work bouts on health status and fitness of less active subjects would be interesting, especially in the first training weeks.",1
1289,The individualized lung cancer modeling can facilitate the evaluation of preoperative risks and allows for more accurate surgical planning.,2
1293,This supports investigation into the potential use of nasal high flow therapy as treatment in viral upper respiratory tract infections.,2
1294,"Using RCT on participatory basis, SMBG with individual dietary counseling was effective in short term.",2
1295,"Based on the theory of dislocation of bone joints in TCM, three kinds of spinal rotation manipulations can be used safely for the treatment of lumbar disc herniation, and the efficacy was similar.",2
1296,"Among adults with septic shock, the early use of vasopressin compared with norepinephrine did not improve the number of kidney failure-free days.",0
1297,Oral Ramosetron 0.1 mg was more effective than placebo in PONV prevention and reduced the incidence of moderate to severe nausea after intrathecal morphine in the first 24 hour after gynecological surgery.,2
1298,ALIF with posterior instrumentation in low grade isthmic spondylolisthesis provides satisfactory outcome in patients requiring surgical treatment.,2
1299,This indicates variability in the ability to use real-time augmented feedback effectively.,2
1300,"The prolonged pharmacodynamic effect of proliposomal ropivacaine, together with its delayed elimination and prolonged redistribution to plasma, is compatible to depot-related slow-release and similar to the performance of other liposomal local anesthetics.",1
1301,"The present study demonstrated that the addition of inspiratory muscle training, even when applied for a short period, may potentiate the effects of combined aerobic and resistance training, becoming a simple and inexpensive strategy for patients who underwent coronary artery bypass and are in phase II cardiac rehabilitation.",2
1303,SIPsmartER is an effective intervention to decrease SSB consumption among adults and is promising for translation into practice settings.,2
1304,"Dose-dependent increases in appendicular lean body mass and decreases in fat mass were observed, although this study did not achieve the threshold of its primary objective.",1
1305,"Conical stone needle on foot combined with Sian anvil at Yintang(GV 29) treating insomnia is safe and effective,and this treatment acquires similar efficacy with less suffering.",2
1306,Close contact casting may be an appropriate treatment for such patients.,1
1307,This study provides modest evidence that rTMS to the l-DLPFC transiently reduces core symptoms of AN and encourages prudent decision making.,2
1308,This suggests that the prevalence of WDTC detected by imaging is not an artifact caused by an increasingly obese population and that any association of WDTC and obesity is not related to the way in which these tumors are detected.,1
1311,"Consumption of milk containing A1 β-casein was associated with increased gastrointestinal inflammation, worsening of PD3 symptoms, delayed transit, and decreased cognitive processing speed and accuracy.",0
1315,"The association of GlcN-S and mud-bath therapy has a positive and safe role in improving pain, function and quality of life in knee OA patients.",2
1316,The test-based approach to the management of malaria did not increase the incidence of malaria or anaemia among under-five children in this setting.,2
1317,"Considering both efficacy and safety, colchicine can be prescribed with a once-daily dosage.",1
1318,"The effectiveness of ARM in the prevention of severe epithelitis in patients with HNC treated with RT is, at least, as effective (or more effective) as other and more common skin treatments.",2
1320,"The decoction prepared with of Nicotiana tabacum leaves, used as mouthwash are well-tolerated and safe, and can be used for the management of recurrent aphthous.",2
1322,Partial STARR combined with Bresler procedure in the treatment of ODS associated with rectocele and IRI has better efficacy than STARR only.,2
1323,Propofol-TCI technique is suggested for laparoscopic and ambulatory surgery.,1
1326,"In patients undergoing MCA intravascular stent implantation for ischemic stroke, perioperative intensive statin therapy improves the patients' outcomes, reduces the levels of CRP, VCAM-1 and sCD147 molecules, and lowers the incidences of cerebrovascular events.",2
1327,"CCD increased good quality embryo rate by down-regulating the expression of ROS protein in ovarian granulosa cells, and correcting in vivo oxidative stress.",2
1328,"Vegethon is a theory-based, user-informed mobile intervention that was systematically developed using the IDEAS framework.",1
1329,No information channel explained differences in county-level vaccine uptake.,1
1330,"During the initial stage of phototherapy, intensive phototherapy can quickly and effectively reduce the serum level of bilirubin in neonates with neonatal hyperbilirubinemia.",1
1331,The laser marker placement device appeared to be a reliable method to place markers on a tape at previously palpated positions and ensures an exact position.,2
1332,Mixing 2% lidocaine with 0.5% bupivacaine to the final concentration of 0.67%for lidocaine and 0.33% for bupivacaine does not reduce the onset of ultrasound-guided infraclavicular brachial plexus block.,1
1334,Further researches are necessary to study functional and long-term results.,1
1335,The greatest analgesic efficacy of both forms was observed during the first two hours after surgery.,1
1336,Further research is required to replicate the effect with more robust methodology and powered for sub-group analysis including socio-economic status.,1
1337,EA improves rectus femoris tension and recovers the internal mechanics balance and the efficacy is better than that of meloxicam.,2
1338,"All of the RM methods can effectively improve oxygenation and pulmonary compliance of the children with complication of ARDS, and they complement the inadequacy of lung protective ventilation.",2
1339,Floating needle therapy and duloxetine were effective in treatment of patients with PSPD.,2
1340,Our findings should incite future studies to prove a potential medically important anti-inflammatory role of propofol in neuroanaesthesia.,1
1342,Adjuvant rosuvastatin treatment in patients diagnosed of DVT improve CRP levels and diminish PTS incidence.,2
1343,A high response rate was obtained and tolerability was good.,2
1344,"This is especially true during the rainy season, even in the absence of identified epidemics.",1
