id,sen,lab
1345,"We also observed strong inter-individual differences in cytokine levels; therefore, patients with an exaggerated inflammatory response to CPB need to be identified.",1
1346,"This is the first double-blind RCT assessing ciclosporin, in the management of T1R in Africa.",1
1347,"The point application in summer for the prevention in winter reduces the attack frequency of pediatric pneumonia, shortens the sick duration and has achieved the better significant efficacy in the cases of lower age, shorter sick duration, less attack frequency and moderate skin reaction.",2
1348,There were no clinically meaningful intervention effects for the adiposity outcomes.,1
1349,"An accurate, fast and simple screening method of Y chromosome AZF microdeletions by capillary technology has been established, which may have an important clinical value.",2
1350,"Public health efforts should emphasize educating older women regarding the risk of using over-the-counter anticholinergics, such as first-generation antihistamines.",1
1352,The findings support the use of dexmedetomidine in patients such as these.,1
1355,Dust mite drops sublingual immunotherapy is effective for the allergic rhinitis children caused by mites.,2
1356,"Local excision for patients with ycT1/2 rectal cancers would, thus, miss metastases in a considerable percentage and might involve the risk of significant undertreatment in a number of patients.",0
1358,"However, more intensive interventions in hospitalized patients and impact on healthcare-associated infections and post-discharge infections should be explored.",1
1359,Addition of the UC-MSC treatment to the standard therapy could help to improve liver function in patients with HBV-DLC.,1
1360,"However, further study is needed to compare the difference between degarelix monotherapy and these combinations.",1
1361,"Acute coffee consumption in non-stressful conditions activated sAA and BP but not salivary cortisol, indicating activation of the sympathetic nervous system.",1
1362,"When compared with results obtained using a traditional cumulus cell removal protocol, early cumulus cell removal has both advantages and disadvantages.",1
1364,"Conducting CBP in the early stage of severe burn is safe and feasible, which does not obviously affect the vital signs, volumes of fluid input and urine output, or platelet count of patients, additionally, it could help protect the function of vital organs, eliminate stress hyperglycemia, and reduce infection rate.",2
1365,"LMV, ADV, LdT, LMV+ADV and ETV were all effective on treatment of decompensated hepatitis B virus-related cirrhosis whereas ETV and LMV+ADV were recommended.",2
1366,"In the absence of a difference in overall survival, these findings suggest that for patients with 1 to 3 brain metastases amenable to radiosurgery, SRS alone may be a preferred strategy.",2
1368,"However, significant toxicities were hurdles to sustained V-FND therapy.",0
1369,"Regular, long-term, customized HE improved the executive function of community-dwelling older people with memory disorders, but the effects were mild and were not observed in other domains of cognition.",1
1370,"The current findings suggest that the concomitant use of PPIs, when clinically indicated, in patients receiving clopidogrel is not associated with adverse clinical outcome.",2
1371,The therapy presents the long-term clinical effect and deserves to be promoted in clinical practice.,2
1379,Our data suggest that individual characteristics could predict the haemodynamic responses.,1
1380,"This exercise programme in cancer patients with 2-3 weekly supervised sessions over three months was well feasible and demonstrated measurable improvement of oxygen consumption, body composition and quality of life.",2
1381,"Regarding success rate, attended time, or number of attempts for radial arterial cannulation, we did not find any benefit of ultrasound guidance compared to palpation technique.",0
1382,The results provide first evidence that variable light can be used to optimize the conditions in child and adolescent psychiatry in order to support the therapeutic success.,2
1385,"If the anterior and posterior cruciate ligament injuries can't be treated simultaneously, the posterior cruciate ligament injuries should be treated preferentially at the first stage and the anterior cruciate ligament injuries should be treated at the second stage.",1
1387,Further studies are needed to assess long-term efficacy and safety.,1
1388,Using the Tegadarm comfort film dressing with aron alpha A [Sankyo] could be an effective fixation method in the continuous femoral nerve block.,2
1389,N3 stage represented an independent prognostic factor and N ratio >70% was a predictive factor for OS and DFS.,1
1390,"Meanwhile, it also could improve their blood pressure and QOL.",2
1391,"Despite that the YouGrabber® is a promising and highly accepted training tool for home-use, currently, it is still error-prone, and the requested support exceeds the support that can be provided by clinical therapists.",0
1393,"A greater understanding of the underlying mechanisms of these motivational deficits in particular, beyond other depressive symptoms, is critical to the development of strategies aimed at enhancing functional recovery and improved subjective well-being.",1
1394,"Under the premise that mouse cannot be used directly during surgery, gesture-controlled approaches demonstrate to be superior to oral instructions for image manipulation.",2
1395,"More females reported poor sleep quality, and sleep quality was inversely related to mental HRQOL by 12 months.",1
1396,"Among patients with systemic sclerosis and active ischemic digital ulcers, treatment with macitentan did not reduce new digital ulcers over 16 weeks.",0
1397,The results suggest that aroma foot massage may be an easy and effective way to improve mental health and blood pressure.,2
1398,"The evaluation of serum biomarkers showed a significant increase of CTX-II only, perhaps due to an increase of cartilage turnover induced by thermal stress.",1
1399,"Implications of this study may be useful in the Asian context where the consumption of high glycemic index, carbohydrate meals is prevalent.",1
1400,"Adjuvant Gliatilin in the complex therapy of progressive glaucoma is appropriate and efficient, especially in case of systemic atherosclerosis and cerebrovascular insufficiency.",2
1401,"The most significant predictor of crossover to IABC in the setting of anterior STEMI was relative hypotension at the time of hospital admission, and crossover to IABC in CRISP AMI was associated with significantly worse clinical outcomes.",1
1403,Intraprocedural application of this information during TAVR significantly reduces the levels of contrast and radiation exposure.,1
1404,Chinese medicine fumigation and massage therapy can early improve the knee function after the anterior cruciate ligament reconstruction operation without the disturbance of the knee stability.,2
1405,"Despite these differences, clinical events at 2 years were similar by race and ethnicity.",1
1406,Further research is needed to determine how to sustain the substantial initial benefits.,1
1407,These findings suggest that MBSR may be an effective treatment option for patients with chronic low back pain.,2
1408,Using EPIC to estimate the degree of distortion in 814 DWI brain tumor images enabled the creation of a topographic atlas of DWI distortion across the brain.,1
1409,Administering interventions via the Internet to older adults is feasible.,2
1410,Significantly less RBL was observed after 1 year of loading around IL implants than around DL implants.,1
1412,We conclude that oxytocin does modulate basic factors of facial emotion processing in chronic depression.,0
1413,Magnesium sulphate as an adjuvant provides rapid onset of epidural anesthesia and prolongs the duration of analgesia with minimal side effects.,2
1415,The acupoint implantation reduces VAS score in the patients of migraine and its clinical efficacy is better than that in the EA group.,2
1416,"MSBD combined with CAG program in treating elderly AML patients with YDTSS, with efficacy enhancing toxicity reducing effect, had distinct advantages in improving physical condition and clinical symptoms, and reducing transfusion dependency.",2
