,id,sen,lab
301,1326,"In patients undergoing MCA intravascular stent implantation for ischemic stroke, perioperative intensive statin therapy improves the patients' outcomes, reduces the levels of CRP, VCAM-1 and sCD147 molecules, and lowers the incidences of cerebrovascular events.",2
305,770,"For multiple ligament injuries in the knee, staged repair and reconstruction can effectively restore knee joint stability and function.",2
307,501,"This therapy provides a valuable tool to accomplish a rapid decrease in vertigo spells in subjects with Meniere's disease, and it is considered an alternative to chemical or surgical labyrinthectomy.",2
308,1388,Using the Tegadarm comfort film dressing with aron alpha A [Sankyo] could be an effective fixation method in the continuous femoral nerve block.,2
310,635,An immune response was observed after primary immunization with Ad26.ZEBOV; boosting by MVA-BN-Filo resulted in sustained elevation of specific immunity.,2
312,1370,"The current findings suggest that the concomitant use of PPIs, when clinically indicated, in patients receiving clopidogrel is not associated with adverse clinical outcome.",2
313,1295,"Based on the theory of dislocation of bone joints in TCM, three kinds of spinal rotation manipulations can be used safely for the treatment of lumbar disc herniation, and the efficacy was similar.",2
314,612,"TCM clinical outcomes rating scale for HF based on patients' report had good reliability, validity and responsiveness, hence it could be used to assess clinical efficacy for HF patients.",2
317,774,"Compared with PB, TPM showed a better effect on epilepsy treatment with less adverse reactions which were worthy of clinical recommendation.",2
318,746,We demonstrated for the first time that AVP values could improve after successful treatment in STEMI patients.,2
321,522,"The moxa salt packets combined with tropisetron hydrochloride can effectively reduce the cisplatin chemotherapy-induced nausea and vomiting as well as the occurrence rate of delayed-type vomiting, and improve the constipation, which is superior to single use of tropisetron hydrochloride.",2
324,1211,"T II A could reduce the incidence of OlPN, which might be associated with inhibiting the expression of CGRP and up-regulating NGF activities.",2
325,1397,The results suggest that aroma foot massage may be an easy and effective way to improve mental health and blood pressure.,2
326,1280,These data support safety and efficacy of TAVR in select very elderly patients.,2
328,549,"Among postmenopausal women with osteoporosis, the use of subcutaneous abaloparatide, compared with placebo, reduced the risk of new vertebral and nonvertebral fractures over 18 months.",2
329,1253,"With regards to the primary aim of this study, there were overall high levels of satisfaction with the intervention, indicating good feasibility and acceptance among patients.",2
332,1355,Dust mite drops sublingual immunotherapy is effective for the allergic rhinitis children caused by mites.,2
333,786,"Targeted therapy combined with chemotherapy for the primary central nervous system lymphoma can improve the patients' outcomes, reduce adverse effects, and improve the quality of life and survival rate.",2
334,1281,A systematic intervention model resulted in partial improvements in LBP care.,2
336,644,There is better patient-proxy agreement for the EQ-5D-3L compared with the ICECAP-O among individuals with mild VCI.,2
337,1394,"Under the premise that mouse cannot be used directly during surgery, gesture-controlled approaches demonstrate to be superior to oral instructions for image manipulation.",2
339,789,"Single-dose preoperative dexamethasone 8 mg 60-90 minute before induction of anesthesia improved clinical outcome in terms of significantly less nausea, vomiting, pain at first 6 hours and less inflammatory response after laparoscopic cholecystectomy compared to placebo.",2
340,1225,"Results of this study suggest that the impact of PA on depressive symptoms varies by genotype and sex, and that PA may mitigate somatic symptoms of depression more than other symptoms.",2
341,674,HE's fire needle therapy is effective on primary varicose veins.,2
343,750,"DDM reduces postoperative pain severity, hospital stay and disability period.",2
350,1294,"Using RCT on participatory basis, SMBG with individual dietary counseling was effective in short term.",2
351,1293,This supports investigation into the potential use of nasal high flow therapy as treatment in viral upper respiratory tract infections.,2
354,1339,Floating needle therapy and duloxetine were effective in treatment of patients with PSPD.,2
358,1415,The acupoint implantation reduces VAS score in the patients of migraine and its clinical efficacy is better than that in the EA group.,2
359,1229,"However, IVR-based interventions may be the optimal choice for those with elevated LDL values at baseline.",2
361,577,"The low lactose milk powder could improve the therapeutic effectively and could reduce the duration of disease, and restored to normal diet for 2 weeks feeding time.",2
364,654,"The effect of oblique insertion at anatomical points for sacroiliac joint injury is superior to that of conventional acupuncture, which can effectively relieve pain and improve the disfunction.",2
365,708,"Nasal endoscope negative pressure cleaning and sinupret drops can significantly reduce the long-term incidence of RNS, especially obviously reduce the incidence of moderate to severe RNS,which is a practical and effective method to treat RNS.",2
367,1305,"Conical stone needle on foot combined with Sian anvil at Yintang(GV 29) treating insomnia is safe and effective,and this treatment acquires similar efficacy with less suffering.",2
369,713,"In patients with active RA, tofacitinib, either in combination with methotrexate or as monotherapy, demonstrated rapid and sustained improvement in pain, physical functioning and health-related quality of life.",2
