,id,sen,lab,negations,neg,neg_bin,predict
151,580,alreadi after three month the effect of train with tailor made notch music is observ in the most direct rate of tinnitus percept   the tinnitus loud  while more global measur of tinnitus distress do not show relev chang ,1,[],0,0,1.0
152,89,blood pressur reduct from combin drug from these digit class can be predict on the basi of addit effect ,2,[],0,0,2.0
153,722,this is the first control studi on the long term effect on profession from implement a develop plan to enhanc user particip in a mental health hospit ,1,[],0,0,1.0
154,1267,more long term studi are thus warrant ,1,[],0,0,1.0
155,1352,the find support the use of dexmedetomidin in patient such a these ,1,[],0,0,1.0
156,214,heterogen in studi design need to be address in futur research in order to test the efficaci of this intervent ,1,[],0,0,1.0
157,361,the use of a sensit assay for troponin i improv earli diagnosi of acut myocardi infarct and risk stratif  regardless of the time of chest pain onset ,2,[],0,0,2.0
158,113,a higher dietari divers  therefor  might be associ with lower possibl of have some metabol disord ,2,[],0,0,2.0
159,608,among critic ill patient treat in icu in brazil  implement of a multifacet qualiti improv intervent with daili checklist  goal set  and clinician prompt did not reduc in hospit mortal ,0,[],0,0,2.0
160,267,the atlff wa NEGATION a use tool to identifi which tongu_NEG tie_NEG infant are at risk for breast_NEG feed_NEG problem_NEG_NEG ,0,"[{u'negex': u'not', u'effectedWords': [{u'words': u'breastfeeding problems'}, {u'words': u'breast feeding problems'}]}, {u'negex': u'not', u'effectedWords': [{u'words': u'tongue tied'}]}]",2,1,0.0
161,697,an understand of all of these mechan will be key in direct the advanc of product most suitabl for combat hiv infect in woman ,1,[],0,0,1.0
162,18,xuezhikang show signific benefit on the incid of all caus death  chd death  myocardi infarct  and revascular a compar with placebo base on convent treatment for chd ,2,[],0,0,2.0
163,213,daili ingest of digit ounc of yogurt contain lactobacillus acidophilus decreas both candid colon and infect ,2,[],0,0,2.0
164,14,our result suggest that  medic expuls therapi   use either alpha antagonist or calcium channel blocker  augment the stone expuls rate compar to standard therapi for moder size distal ureter stone ,2,[],0,0,1.0
165,160,the two treatment appli had similar effect a they both reliev pain and reduc the size of recurr aphthous ulcer ,2,[],0,0,2.0
166,79,howev  problem with standard and safeti concern may limit their applic in clinic practic ,1,[],0,0,1.0
167,633,in a nation repres sampl of coupl  the ourrelationship program wa effect in signific improv both relationship and individu function  suggest it can substanti increas the reach of current intervent through it low cost  web base format ,2,[],0,0,2.0
168,95,to the best of our knowledg this is the first clinic trial that support this indic for saffron ,1,[],0,0,1.0
169,756,they were also associ with lower frequenc of postop vomit ,2,[],0,0,1.0
170,130,thus  ac patient should be start in hospit and continu long term on intens statin therapi ,1,[],0,0,1.0
171,103,corticosteroid provid symptomat relief of pain in sore throat  in addit to antibiot therapi  main in particip with sever or exud sore throat ,2,[],0,0,0.0
172,356,there is evid of a signific reduct in mortal from aaa in men age digit to digit year who undergo ultrasound screen ,2,[],0,0,2.0
173,648,at the recoveri room  no signific efficaci differ between low dose ketamin  digit digit mg kg  and placebo in the prevent of post oper shiver in patient who underw orthoped surgeri wa observ ,0,[],0,0,0.0
174,102,those who are femal  diabet and have neurophysiolog confirm of diagnosi have the highest risk of relaps ,0,[],0,0,0.0
175,1296,among adult with septic_NEG shock_NEG  the earli use of vasopressin compar with norepinephrin did NEGATION improv the number of kidney failur_NEG NEGATION day ,0,"[{u'negex': u'not', u'effectedWords': [{u'words': u'Renal failure'}]}, {u'negex': u'free', u'effectedWords': [{u'words': u'Septic Shock'}]}]",2,1,0.0
176,386,the digit year outcom were similar for patient assign to earli surgeri and those assign to conserv treatment with eventu surgeri if need  but the rate of pain relief and of perceiv recoveri were faster for those assign to earli surgeri ,2,[],0,0,2.0
177,737,howev  over more than a decad of follow up  near digit  of patient develop recurr becaus of new non pv trigger ,0,[],0,0,2.0
178,168,trial evid that examin the effect of n digit pufa on depress mood is limit and is difficult to summar and evalu becaus of consider heterogen ,1,[],0,0,1.0
179,87,colchicin prophylaxi dure initi of allopurinol for chronic gouti arthriti reduc the frequenc and sever of acut flare  and reduc the likelihood of recurr flare ,2,[],0,0,0.0
180,365,this studi wa design to evalu the effect of the antioxid flavonoid silymarin in improv long term and postprandi glycem and weight control in type digit diabet patient treat with glibenclamid ,1,[],0,0,2.0
181,307,behavior risk factor  specif smoke and oral contracept use  mark increas the risk of pmva  a did recent onset of pmva ,0,[],0,0,0.0
182,218,among patient who have recent had an acut coronari syndrom  an intens lipid lower statin regimen provid greater protect against death or major cardiovascular event than doe a standard regimen ,2,[],0,0,2.0
183,1403,intraprocedur applic of this inform dure tavr signific reduc the level of contrast and radiat exposur ,1,[],0,0,2.0
